{
  "schemaVersion": 1,
  "name": "AiCoding Kit Registry",
  "defaultMode": "repo-scoped",
  "kits": [
    {
      "id": "aicoding-platform",
      "enabled": true,
      "order": 10,
      "manifest": "config/kits/aicoding-platform.json"
    },
    {
      "id": "docsync-plus",
      "enabled": true,
      "order": 50,
      "manifest": "config/kits/docsync-plus.json"
    },
    {
      "id": "reuse-governance",
      "enabled": true,
      "order": 60,
      "manifest": "config/kits/reuse-governance.json"
    },
    {
      "id": "common-control-kit",
      "enabled": true,
      "order": 70,
      "manifest": "config/kits/common-control-kit.json"
    },
    {
      "id": "release-governance-overlay-kit",
      "enabled": true,
      "order": 80,
      "manifest": "config/kits/release-governance-overlay-kit.json"
    }
  ]
}
